{"closeout":[{"kind":"shared","node":"closeout","requires":["outcome"]}],"compatibility":"aquarium.adaptive/v1","entrypoints":["task-handler"],"family":"task","goal_assessments":[{"node":"outcome","outcomes":{"achieved":"achieved","not-achieved":"not_achieved","stopped":"not_achieved","superseded":"superseded"}}],"nodes":{"assess":{"capabilities":[{"fields":{},"signature":"aquarium.task.final-assessment/v1"}],"effects":[],"kind":"action","role":"judge"},"assessment-current":{"capabilities":[],"effects":[],"kind":"decision","role":"orchestrator"},"closeout":{"capabilities":[],"effects":[],"kind":"action","role":"orchestrator"},"goal-route":{"capabilities":[],"effects":[],"kind":"decision","role":"orchestrator"},"outcome":{"capabilities":[],"effects":[],"kind":"decision","role":"orchestrator"}},"obligations":{"original-goal":{"applicability":"All due original work, selected reviews, effects and acceptance obligations; this template alone does not establish them.","assessor":"assess","decision":"outcome","effects":[],"evidence":[{"item":"judge-applicability","node":"assess"}],"producers":[{"item":"judge-assessment","node":"assess"}],"source":"Complete original requirement and approved workflow basis supplied by the invoking assignment."}},"origins":[],"parameters":{},"procedure":{"digest":"sha256:c342e763053ecae27e7dc96c0c800b01f191269f5472d91ede5a6643ee5d6869","id":"aquarium-task-goal-control","source_sha256":"sha256:f9a9920b207658f046740033b0de69d919e96135d90c2266ec2f1cf8b62ac1ef","version":"2"},"schema":"aquarium.procedure-binding/v1"}