{"closeout":[{"kind":"shared","node":"finish","requires":["approve","choose-outcome"]}],"compatibility":"aquarium.adaptive/v1","entrypoints":["task-handler"],"family":"task","goal_assessments":[{"node":"choose-outcome","outcomes":{"accepted":"achieved","replaced":"superseded","stopped":"not_achieved"}}],"nodes":{"approve":{"capabilities":[{"fields":{},"signature":"aquarium.task.approval/v1"}],"effects":[],"kind":"decision","role":"orchestrator"},"assess":{"capabilities":[{"fields":{},"signature":"aquarium.task.final-assessment/v1"}],"effects":[],"kind":"action","role":"judge"},"choose-outcome":{"capabilities":[],"effects":[],"kind":"decision","role":"orchestrator"},"finish":{"capabilities":[{"fields":{},"signature":"aquarium.task.closeout/v1"}],"effects":["authorized-closeout"],"kind":"action","role":"orchestrator"},"write":{"capabilities":[],"effects":["canonical-documentation"],"kind":"action","role":"worker"}},"obligations":{"documentation":{"applicability":"Canonical documentation changes are due.","assessor":"assess","decision":"choose-outcome","effects":["canonical-documentation"],"evidence":[{"item":"judge-assessment","node":"assess"}],"producers":[{"item":"worker-handoff","node":"write"}],"source":"approved requirements / documentation acceptance"}},"origins":[],"parameters":{"document":{"description":"Approved document target and original requirement source reference.","required":true,"type":"text"}},"procedure":{"digest":"sha256:aaaaaaaaaaaaaaaaaaaaaaaaaaaaaaaaaaaaaaaaaaaaaaaaaaaaaaaaaaaaaaaa","id":"aquarium-adapt-task-documentation-example","source_sha256":"sha256:bbbbbbbbbbbbbbbbbbbbbbbbbbbbbbbbbbbbbbbbbbbbbbbbbbbbbbbbbbbbbbbb","version":"1"},"schema":"aquarium.procedure-binding/v1"}