{"closeout":[{"kind":"shared","node":"finish","requires":["approve","choose-outcome"]}],"compatibility":"aquarium.adaptive/v1","entrypoints":["task-handler"],"family":"task","goal_assessments":[{"node":"choose-outcome","outcomes":{"accepted":"achieved","replaced":"superseded","stopped":"not_achieved"}}],"nodes":{"approve":{"capabilities":[{"fields":{},"signature":"aquarium.task.approval/v1"}],"effects":[],"kind":"decision","role":"orchestrator"},"assess":{"capabilities":[{"fields":{},"signature":"aquarium.task.final-assessment/v1"}],"effects":[],"kind":"action","role":"judge"},"choose-outcome":{"capabilities":[],"effects":[],"kind":"decision","role":"orchestrator"},"compare-measurements":{"capabilities":[],"effects":[],"kind":"decision","role":"orchestrator"},"finish":{"capabilities":[{"fields":{},"signature":"aquarium.task.closeout/v1"}],"effects":["authorized-closeout"],"kind":"action","role":"orchestrator"},"optimize-and-sample":{"capabilities":[],"effects":["product-code","measurement-evidence"],"kind":"action","role":"worker"},"sample-baseline":{"capabilities":[],"effects":["measurement-evidence"],"kind":"action","role":"worker"}},"obligations":{"performance":{"applicability":"Performance change with an actual measurement requirement.","assessor":"assess","decision":"compare-measurements","effects":["product-code","measurement-evidence"],"evidence":[{"item":"measurements","node":"sample-baseline"},{"item":"measurements","node":"optimize-and-sample"},{"item":"judge-assessment","node":"assess"}],"producers":[{"item":"measurements","node":"sample-baseline"},{"item":"measurements","node":"optimize-and-sample"}],"source":"approved requirements / performance acceptance"}},"origins":[],"parameters":{"metric":{"description":"Approved performance metric and reproducible input.","required":true,"type":"text"},"threshold":{"description":"Requirement-owned acceptable bound.","required":true,"type":"integer"}},"procedure":{"digest":"sha256:aaaaaaaaaaaaaaaaaaaaaaaaaaaaaaaaaaaaaaaaaaaaaaaaaaaaaaaaaaaaaaaa","id":"aquarium-adapt-task-performance-example","source_sha256":"sha256:bbbbbbbbbbbbbbbbbbbbbbbbbbbbbbbbbbbbbbbbbbbbbbbbbbbbbbbbbbbbbbbb","version":"1"},"schema":"aquarium.procedure-binding/v1"}